<?xml version="1.0" encoding="UTF-8"?>
<config xmlns:xsi="http://www.w3.org/2001/XMLSchema-instance" xsi:noNamespaceSchemaLocation="SolrFacetConfig.xsd">

  <solrconfig>
    <mode>embedded</mode>
    <clusterconfig>
    	<endpointURLs>
      		<endpointURL timeout="0">endpointURL</endpointURL>
		    <endpointURL timeout="0">endpointURL2</endpointURL>
    	</endpointURLs>
    </clusterconfig>
  </solrconfig>
  
  <indexconfig>
    <exportpath>exportpath</exportpath>
    <batchSize>100</batchSize>
    <numberOfThreads>1</numberOfThreads>
  </indexconfig>
  
  <itemTypes>
    <itemType code="" variant="false" identityProvider="">
      <properties>
        <property facet="true" name="" type="string" rangeSet="" valueProvider=""/>
      </properties>
      <flexibleSearchUpdateQueries>
        <fullIndexQuery user="anonymous" injectLastIndexTime="true" injectCurrentDate="false" parameterProvider="">
          SELECT {PK} FROM ....
        </fullIndexQuery>
        <updateIndexQuery user="anonymous">
          SELECT {PK} FROM ....
        </updateIndexQuery>
        <deleteFromIndexQuery user="anonymous">
          SELECT {PK} FROM ....
        </deleteFromIndexQuery>
      </flexibleSearchUpdateQueries>
    </itemType>
    </itemTypes>
  
</config>