<?xml version="1.0" encoding="UTF-8"?>
<config xmlns:xsi="http://www.w3.org/2001/XMLSchema-instance" xsi:noNamespaceSchemaLocation="../config/SolrFacetConfig.xsd">
  <solrconfig>
    <mode>embedded</mode>
    <clusterconfig embeddedMaster="true">
    	<aliveCheckInterval>5000</aliveCheckInterval>
    	<connectionTimeout>5000</connectionTimeout>
    	<readTimeout>5000</readTimeout>
    	<endpointURLs>
      		<endpointURL master="true">http://localhost:8983/solr</endpointURL>
    	</endpointURLs>
    </clusterconfig>
  </solrconfig>
  <indexconfig>
    <batchSize>100</batchSize>
  </indexconfig>
  <itemTypes>
    <itemType code="Product" variant="false" identityProvider="itemIdentityProvider">
      <properties>
      	<property name="code" type="string"/>
      	<property name="name" type="text" sortableType="sortabletext" localized="true"/>
      	<property name="description" type="text" localized="true"/>
        <property facet="true" name="manufacturerName" type="string" sortableType="sortabletext"/>
        <property facet="true" name="price" type="double" valueProvider="productPriceValueProvider" rangeSet="priceRanges" currency="true"/>
        <property facet="true" name="processor" type="string" valueProvider="classificationPropertyValueProvider" multiValue="true"/>
        <property facet="true" name="categoryName" type="string" valueProvider="categoryNameValueProvider" localized="true" multiValue="true"/> 
        <property facet="true" name="categoryCode" facetDisplayNameProvider="categoryFacetDisplayNameProvider" type="string" valueProvider="categoryCodeValueProvider" multiValue="true"/>
        <property facet="true" name="type" type="string" valueProvider="classificationPropertyValueProvider" localized="true" multiValue="true"/>
      </properties>
      <flexibleSearchUpdateQueries>
        <fullIndexQuery user="anonymous">
			SELECT {pk} FROM {Product}
        </fullIndexQuery>
        <updateIndexQuery user="anonymous" injectLastIndexTime="true">
			SELECT {PK} FROM {Product} 
			WHERE {modifiedtime} &gt;= ?lastIndexTime
        </updateIndexQuery>
        <deleteFromIndexQuery>
        	SELECT {PK} FROM {Product} WHERE code = 'HW2310-1001'
        </deleteFromIndexQuery>
      </flexibleSearchUpdateQueries>
    </itemType>
  </itemTypes>
</config>